{
  "schemaVersion": "1.0.0",
  "batchId": "BR-001-checkout-refunds",
  "fingerprint": "8e2b7d4c1a09f36e5d2c8b7a6f4e3d2c1b0a9f8e7d6c5b4a3928170f6e5d4c3b",
  "revision": "0123456789abcdef0123456789abcdef01234567",
  "confirmation": {
    "path": "specs/batches/BR-001-checkout-refunds/records/confirmation-8e2b7d4c1a09.json",
    "sha256": "a1b2c3d4e5f60718293a4b5c6d7e8f90a1b2c3d4e5f60718293a4b5c6d7e8f90"
  },
  "preflight": {
    "path": "specs/batches/BR-001-checkout-refunds/records/preflight-8e2b7d4c1a09-1.json",
    "sha256": "0f1e2d3c4b5a69788796a5b4c3d2e1f00f1e2d3c4b5a69788796a5b4c3d2e1f0"
  },
  "semanticReportSha256": "0f1e2d3c4b5a69788796a5b4c3d2e1f00f1e2d3c4b5a69788796a5b4c3d2e1f0",
  "stories": [
    {
      "id": "RF-001",
      "path": "specs/stories/RF-001-refund-request",
      "dependsOn": []
    },
    {
      "id": "RF-002",
      "path": "specs/stories/RF-002-refund-approval",
      "dependsOn": [
        "RF-001"
      ]
    }
  ],
  "goalId": "BR-001-checkout-refunds-8e2b7d4c1a09",
  "authorization": {
    "observedSource": "session",
    "reference": "使用者在本次會話明確要求交付執行（未驗證身份，效果前需重新解析）"
  },
  "generatedAt": "2026-09-17T10:01:00Z"
}
